{
  "classification": {
    "major": false,
    "reasons": [
      "voluntary cyber-threat notification: precursor activity observed against a peer financial entity in the same operating region."
    ],
    "rule_ids": [
      "dora.threat.voluntary_precursor"
    ]
  },
  "impact_indicators": {
    "indicators_of_compromise": [
      "ioc:domain:phish-bait.invalid",
      "ioc:url:https://phish-bait.invalid/login"
    ]
  },
  "incident_id": "22222222-3333-4444-8555-666666666666",
  "mitigation_status": {
    "actions_in_flight": [
      "Distributed indicators of compromise to peer financial entities through the regional sharing channel."
    ],
    "state": "in_flight"
  },
  "provenance": {
    "captured_at": "2026-06-02T14:00:00Z",
    "source_url": "https://example.org/runs/dora_art19_report_example_0001"
  },
  "regulation_refs": [
    "dora:art-19-cyber-threat-voluntary"
  ],
  "report_id": "00440c6db825c24d75ff0a27d4608a4e0494702929ce7425406a2b43e489c6de",
  "report_variant": "voluntary_cyber_threat",
  "schema_version": "1.0.0",
  "submitted_at": "2026-06-02T14:00:00Z",
  "timeline_refs": {
    "clock_started_at": "2026-06-01T12:00:00Z",
    "stage_event_id": "1122334455667788",
    "timeline_handle": "threat-timeline/feedface12345678"
  }
}
