{
  "classification": {
    "cross_border": true,
    "major": true,
    "reasons": [
      "significance_rule=major_disruption_two_member_states: severe service disruption across two or more Member States",
      "cross_border_rule=multi_member_state: incident materially affected users in two or more Member States"
    ],
    "recurring_incident": false,
    "rule_ids": [
      "dora.sig.severe_disruption",
      "dora.cb.multi_member_state"
    ]
  },
  "impact_indicators": {
    "data_loss_indicator": "unknown",
    "geographic_scope": [
      "NL",
      "DE"
    ]
  },
  "incident_id": "11111111-2222-4333-8444-555555555555",
  "mitigation_status": {
    "actions_in_flight": [
      "Isolated the affected segment from the public network and initiated containment per the operator's runbook."
    ],
    "state": "in_flight"
  },
  "provenance": {
    "captured_at": "2026-06-09T08:30:00Z",
    "source_url": "https://example.org/runs/dora_art19_report_example_0001"
  },
  "regulation_refs": [
    "dora:art-19-initial-4h"
  ],
  "report_id": "6ff555a617b13a99b343d4d881da2b3e61444b7739bbaa215bee6b86f38d68dd",
  "report_variant": "initial_4h",
  "schema_version": "1.0.0",
  "submitted_at": "2026-06-09T08:30:00Z",
  "timeline_refs": {
    "clock_started_at": "2026-06-09T05:00:00Z",
    "stage_event_id": "0123456789abcdef",
    "timeline_handle": "incident-timeline/abcd1234ef567890"
  }
}
