{
  "classification": {
    "cross_border": true,
    "major": true,
    "reasons": [
      "significance_rule=major_disruption_two_member_states: severe service disruption across two or more Member States",
      "cross_border_rule=multi_member_state: incident materially affected users in two or more Member States"
    ],
    "recurring_incident": false,
    "rule_ids": [
      "dora.sig.severe_disruption",
      "dora.cb.multi_member_state"
    ]
  },
  "impact_indicators": {
    "affected_clients_count": 1200,
    "affected_functions": [
      "payments_settlement",
      "client_onboarding"
    ],
    "data_loss_indicator": "availability",
    "duration_minutes": 360,
    "geographic_scope": [
      "NL",
      "DE",
      "FR"
    ],
    "indicators_of_compromise": [
      "ioc:hash:abc123",
      "ioc:domain:example.invalid"
    ]
  },
  "incident_id": "11111111-2222-4333-8444-555555555555",
  "mitigation_status": {
    "completed_actions": [
      "Isolated the affected segment and restored the impacted function from a clean replica.",
      "Rotated every credential in the affected scope and validated detections against a regression test set."
    ],
    "residual_risk": "Trust-store update propagation remains a single-failure-mode dependency on the upstream provider; remediation tracked under the next quarterly review.",
    "root_cause": "An upstream provider's certificate-rotation procedure failed to update the downstream trust store within the documented window; the resulting trust failure cascaded into the dependent settlement function.",
    "state": "remediated"
  },
  "provenance": {
    "captured_at": "2026-07-09T09:00:00Z",
    "source_url": "https://example.org/runs/dora_art19_report_example_0001"
  },
  "regulation_refs": [
    "dora:art-19-final-one-month"
  ],
  "report_id": "02ce9fe4a1f9d7aa6978170f0068bd820c91667ca7f62fdb1096a1e4544ae8fe",
  "report_variant": "final_1mo",
  "schema_version": "1.0.0",
  "submission_ref": "csirt-ticket-2026-073",
  "submitted_at": "2026-07-09T09:00:00Z",
  "timeline_refs": {
    "clock_started_at": "2026-06-09T05:00:00Z",
    "previous_milestone_event_id": "fedcba9876543210",
    "stage_event_id": "abcdef0123456789",
    "timeline_handle": "incident-timeline/abcd1234ef567890"
  }
}
